{
  "clients": {
    "ipify": {
      "address": "https://api.ipify.org",
      "timeout": 15
    }
  },
  "enabled": true,
  "log": {
    "address": "",
    "format": "JSON",
    "level": "INFO",
    "network": ""
  },
  "remoteConfigEndpoint": "",
  "remoteConfigPath": "",
  "remoteConfigProvider": "",
  "remoteConfigSecretKeyring": "",
  "servers": {
    "monitoring": {
      "address": ":65501",
      "timeout": 5
    }
  },
  "stats": {
    "excluded_nics": ["lo", "docker0"]
  },
  "shutdown_timeout": 30
}
